Description,URL,Tiny URL,Query,file title ,download settings and parameters,note,**Note: all corpora = all corpora except treebank corpusFull corpora query for Sketis,http://corpling.uis.georgetown.edu/annis/?id=dba22fd5-84dc-4d6c-9415-852c05b49263,,"lemma=_""_____""",annis-export-sketis-allcorpora.txt,"simpletext, metakeys=author,title,document_cts_urn,version_n,version_date",,Full corpora query for house,http://corpling.uis.georgetown.edu/annis/?id=8a83e0c2-64ea-4bab-8263-2ab5949f4b72,,"lemma=_""___""",,"csv export, metakeys=annis:doc,corpus,version_n,version_date,annotation",,"nonbiblical corpora query for house, no redundancies",http://corpling.uis.georgetown.edu/annis/?id=269bb3de-e57c-4f83-83fc-06eae2eec2af,,"meta::corpus=_/.*_/ & lemma=_""___"" & meta::title!=_/.*para.*_/",frequency-house-noredundancies-nonbibilicalcorpora.png,"raw frequency generated by corpus, screenshot of ANNIS generated histogram",,"nonbiblical corpora query for house, no redundancies",http://corpling.uis.georgetown.edu/annis/?id=269bb3de-e57c-4f83-83fc-06eae2eec2af,,"meta::corpus=_/.*_/ & lemma=_""___"" & meta::title!=_/.*para.*_/",house-nonbiblicalcorpora-noredundancies-frequencies.txt,raw frequency generated by corpus,,hagiography query for house,http://corpling.uis.georgetown.edu/annis/?id=d96eb52b-92f6-4155-818f-b39a32b73246,,"lemma=_""___""",annis-export-house-hagiographicalcorpora-2Dec2019.txt,,,"Full corpora query for mountain, tagging=gold only",http://corpling.uis.georgetown.edu/annis/?id=0a28e6be-b403-40e9-8e2c-13b509426130,,"lemma=_""_____"" & meta::tagging=_""gold_""",annis-export-mountain-goldtagging-nov2019.txt,annis-export-mountain-goldtagging-nov2019.txt,,"non-biblical corpora NPROP query, no redundancies",http://corpling.uis.georgetown.edu/annis/?id=5add4c96-dedf-469e-8e9b-716caf42e368,,"meta::corpus=_/.*_/ & pos=_""NPROP_"" _o_ lemma & meta::title!=_/.*para.*_/ ",annis-frequency-download-nprop-nonbiblical-noredundancies.txt,frequency of lemmas tagged as propernames downloaded,,"non-biblical corpora NPROP query, no redundancies",http://corpling.uis.georgetown.edu/annis/?id=5add4c96-dedf-469e-8e9b-716caf42e368,,"meta::corpus=_/.*_/ & pos=_""NPROP_"" _o_ lemma & meta::title!=_/.*para.*_/ ",annis-export-nprop-fullcorpora-noredundancies.txt,"csv, metakeys=annis:doc,corpus,version_n,version_date,annotation",,Voyant collocations,"https://voyant-tools.org/?corpus=b2375e08c410719ad5d34cd8f97b687e&panels=corpuscollocates,summary",,section 1 of paper 14 November 2019,,"Collocations auto-stop words, context 5",,Corpus query 5 lemmas either side of Sketis,http://corpling.uis.georgetown.edu/annis/?id=da5c21af-1ae5-4d37-8c63-68d080ca6b2f,,"(n1#lemma=_""_____"" . 1,5 n2#lemma=_/.*_/ )|(n2#lemma=_/.*_/ . 1,5 n1#lemma=_""_____"")",annis-export-sketis-l5r5.csv,csv exporter,,Cleaned data of corpus query 5 lemmas either side of Sketis,http://corpling.uis.georgetown.edu/annis/?id=da5c21af-1ae5-4d37-8c63-68d080ca6b2f,,"(n1#lemma=_""_____"" . 1,5 n2#lemma=_/.*_/ )|(n2#lemma=_/.*_/ . 1,5 n1#lemma=_""_____"")",annis-download-sketis-l5r5-cleaned-filtered.txt ,removed unnecessary annotations and organized data from annis-export-sketis-l5r5.csv,,House all corpora l5 r5,http://corpling.uis.georgetown.edu/annis/?id=fae46f37-443f-41da-93d2-a1ec21b97cb5,,"(lemma=_/___/ . 1,5 lemma=_/.*_/)|(lemma=_/.*_/ . 1,5 lemma=_/___/)",annis-export-house-fullcorpora-5l5r-nov2019.txt,"CSV exporter, metakeys=annis:doc",,"collocates of house, all corpora, no redundancies",http://corpling.uis.georgetown.edu/annis/?id=f8b7bd3a-cf70-4c10-a60a-4edff38f5b51,,,collocates-house-allnonredundantcorpora-nov2019.txt,text file that is cleaned version of data in annis-export-house-fullcorporaÉ (and copy of sheet 2 of house-5l-5r-fullcorpora-termsidsdocs-noredundancies.xlsx),,Jerusalem frequencies all corpora no redundancies,http://corpling.uis.georgetown.edu/annis/?id=cfa9147c-a177-4554-b8d4-602ebf5294dc,,lemma=_/___________|____________/ & meta::title!=_/41_Mark.*|46_1.*|.*para.*_/ & meta::corpus=_/.*_/,Jerusalem-frequencies-allcorp-noredundancies-nov2019.txt,freqency csv export,,Jerusalem l5r5 all corpora no redundancies,http://corpling.uis.georgetown.edu/annis/?id=d7ad4d27-0d05-4491-afbb-878792fe7959,,"meta::title!=_/41_Mark.*|46_1.*|.*para.*_/ & ((lemma=_/___________|____________/ . 1,5 lemma=_/.*_/)|(lemma=_/.*_/ . 1,5 lemma=_/___________|____________/))",annis-export-Jerusalem-l5r5-noredundancies-allcorpora-18Nov2019.txt,csv 0l 0r metakeys=annis:doc,,Jerusalem and Sketis frequencies across corpora no redundancies,,,,Jerusalem-Sketis-frequencies-noredundancies-across-corpora.txt,compiled data from other queries,,Israel l5lr nonbiblical corpora noredundancies annis download,http://corpling.uis.georgetown.edu/annis/?id=fa101edb-0c9b-4d14-9062-73990a791dc7,,"meta::title!=_/.*para.*_/ & ((lemma=_/_______/ . 1,5 lemma=_/.*_/)|(lemma=_/.*_/ . 1,5 lemma=_/_______/))",annis-export-Israel-nonbiblical-noredund-l5r5.txt,"csv exporter no parameters, metakeys=annis:doc,version_date,version_n",,NPROP nonbiblical corpora no redundancies,http://corpling.uis.georgetown.edu/annis/?id=d958d880-e073-44e0-88e8-7e96cefac8a3,,"meta::corpus=_/.*_/ & pos=_""NPROP_"" _o_ lemma & meta::title!=_/.*para.*_/ ",nonbiblical-NPROP-frequencies-noredundancies.txt,,,Egypt l5lr nonbiblical corpora no redundancies annis download,http://corpling.uis.georgetown.edu/annis/?id=9fc5f368-55d2-4e6f-ac48-f0e0b582361a,,"meta::title!=_/.*para.*_/ & ((lemma=_/_____/ . 1,5 lemma=_/.*_/)|(lemma=_/.*_/ . 1,5 lemma=_/_____/))",annis-export-Egypt-l5r5-nonbiblicalcorpora-noredundancies-Nov2019.txt,,,dependency search gold treebank corpus Jerusalem,http://corpling.uis.georgetown.edu/annis/?id=38f76206-59df-42fd-a282-05a16645609c,,lemma=_/___________|____________/ ->dep[func=_/.*_/]lemma,annis-export-Jerusalem-dependencies-treebankgold.txt,"csv export metakeys=annis:doc,corpus,version_n,version_date,annotation",,"dependency search gold treebank corpus ""house""",http://corpling.uis.georgetown.edu/annis/?id=ea6400da-730d-4967-b622-fed9ef5f9830,,lemma=_/___/ ->dep[func=_/.*_/]lemma,annis-export-house-dependencies-treebankgold.txt,"csv export metakeys=annis:doc,corpus,version_n,version_date,annotation",,